{
  "schemaVersion": "0.1",
  "executionId": "11111111-1111-4111-8111-111111111111",
  "organizationId": "22222222-2222-4222-8222-222222222222",
  "monitorId": "33333333-3333-4333-8333-333333333333",
  "monitorVersion": 1,
  "scheduledAt": "2026-09-04T00:00:00Z",
  "deadlineAt": "2099-09-04T00:00:30Z",
  "config": {
    "kind": "http",
    "url": "http://test-target:8080/healthy",
    "method": "GET",
    "timeoutMs": 5000,
    "expectedStatus": 200,
    "maxRedirects": 5,
    "maxResponseBytes": 1048576
  }
}
