{
  "schemaVersion": "0.2",
  "executionId": "0e6bc903-8824-4f24-9b22-83b53cfa11d4",
  "organizationId": "50dd02a1-5d07-4e08-98e3-05ecbc8eef1b",
  "monitorId": "e5512bc8-b210-4f51-b0e5-79a0bfa1841e",
  "monitorVersion": 1,
  "scheduledAt": "2026-09-08T08:00:00Z",
  "deadlineAt": "2026-09-08T08:02:30Z",
  "config": {
    "kind": "keyword",
    "url": "https://example.com/status",
    "method": "GET",
    "expectedStatus": 200,
    "keyword": "SYSTEM_HEALTHY",
    "matchMode": "CONTAINS",
    "caseSensitive": true,
    "maxRedirects": 3,
    "maxResponseBytes": 1048576,
    "timeoutMs": 5000
  }
}
